{
  "schema_version": 1,
  "slug": "inverse-2x2-singular",
  "course": "MATH1104",
  "type": "matrix_inverse",
  "statement": "Find A\u207b\u00b9 if it exists.",
  "given": {
    "matrix": [
      [
        "1",
        "2"
      ],
      [
        "2",
        "4"
      ]
    ]
  },
  "source": {
    "kind": "typed",
    "ref": "GoatVex benchmark (hand-checked)"
  },
  "context": {
    "graded": false
  },
  "confirmed_by_student": true,
  "expected": {
    "invertible": false
  }
}
