{
  "schema_version": 1,
  "slug": "inverse-2x2-det1",
  "course": "MATH1104",
  "type": "matrix_inverse",
  "statement": "Find A⁻¹ if it exists.",
  "given": {
    "matrix": [
      [
        "2",
        "1"
      ],
      [
        "5",
        "3"
      ]
    ]
  },
  "source": {
    "kind": "typed",
    "ref": "GoatVex benchmark (hand-checked)"
  },
  "context": {
    "graded": false
  },
  "confirmed_by_student": true,
  "expected": {
    "inverse": [
      [
        "3",
        "-1"
      ],
      [
        "-5",
        "2"
      ]
    ]
  },
  "topic": "matrix-inverse"
}
