{
  "schema_version": 1,
  "slug": "derivative-product-trig",
  "course": "MATH1004",
  "type": "derivative",
  "statement": "Differentiate f(x) = x^2 sin(x).",
  "given": {
    "function": "x^2 sin(x)",
    "variable": "x"
  },
  "source": {
    "kind": "typed",
    "ref": "GoatVex benchmark (hand-checked)"
  },
  "context": {
    "graded": false
  },
  "confirmed_by_student": true,
  "expected": {
    "derivative": "2x sin(x) + x^2 cos(x)"
  }
}
