{
  "schema_version": 1,
  "slug": "rref-sys-unique-3x3",
  "course": "MATH1104",
  "type": "rref",
  "statement": "Solve x + y + z = 6, 2y + 5z = \u22124, 2x + 5y \u2212 z = 27.",
  "given": {
    "matrix": [
      [
        "1",
        "1",
        "1",
        "6"
      ],
      [
        "0",
        "2",
        "5",
        "-4"
      ],
      [
        "2",
        "5",
        "-1",
        "27"
      ]
    ],
    "augmented": true
  },
  "source": {
    "kind": "typed",
    "ref": "GoatVex benchmark (hand-checked)"
  },
  "context": {
    "graded": false
  },
  "confirmed_by_student": true,
  "expected": {
    "rref": [
      [
        "1",
        "0",
        "0",
        "5"
      ],
      [
        "0",
        "1",
        "0",
        "3"
      ],
      [
        "0",
        "0",
        "1",
        "-2"
      ]
    ],
    "system": {
      "status": "unique",
      "x": [
        "5",
        "3",
        "-2"
      ]
    }
  }
}
