{
  "schema_version": 1,
  "slug": "derivative-product-of-powers",
  "course": "MATH1004",
  "type": "derivative",
  "statement": "Differentiate f(x) = (2x - 1)^3 (x + 2)^2.",
  "given": {
    "function": "(2x - 1)^3 (x + 2)^2",
    "variable": "x"
  },
  "source": {
    "kind": "typed",
    "ref": "GoatVex benchmark (hand-checked)"
  },
  "context": {
    "graded": false
  },
  "confirmed_by_student": true,
  "expected": {
    "derivative": "10(x + 1)(x + 2)(2x - 1)^2"
  }
}
