{
  "schema_version": 1,
  "slug": "rref-sys-one-free",
  "course": "MATH1104",
  "type": "rref",
  "statement": "Solve x \u2212 y + z = 1, 2x + y \u2212 z = 5, 3x = 6.",
  "given": {
    "matrix": [
      [
        "1",
        "-1",
        "1",
        "1"
      ],
      [
        "2",
        "1",
        "-1",
        "5"
      ],
      [
        "3",
        "0",
        "0",
        "6"
      ]
    ],
    "augmented": true
  },
  "source": {
    "kind": "typed",
    "ref": "GoatVex benchmark (hand-checked)"
  },
  "context": {
    "graded": false
  },
  "confirmed_by_student": true,
  "expected": {
    "rref": [
      [
        "1",
        "0",
        "0",
        "2"
      ],
      [
        "0",
        "1",
        "-1",
        "1"
      ],
      [
        "0",
        "0",
        "0",
        "0"
      ]
    ],
    "system": {
      "status": "infinite",
      "free_vars": [
        3
      ]
    }
  }
}
