{
  "schema_version": 1,
  "slug": "rref-sys-unique-4x4",
  "course": "MATH1104",
  "type": "rref",
  "statement": "Solve the 4\u00d74 system.",
  "given": {
    "matrix": [
      [
        "1",
        "1",
        "1",
        "1",
        "2"
      ],
      [
        "1",
        "-1",
        "0",
        "2",
        "2"
      ],
      [
        "2",
        "0",
        "1",
        "-1",
        "4"
      ],
      [
        "0",
        "1",
        "1",
        "3",
        "1"
      ]
    ],
    "augmented": true
  },
  "source": {
    "kind": "typed",
    "ref": "GoatVex benchmark (hand-checked)"
  },
  "context": {
    "graded": false
  },
  "confirmed_by_student": true,
  "expected": {
    "rref": [
      [
        "1",
        "0",
        "0",
        "0",
        "1"
      ],
      [
        "0",
        "1",
        "0",
        "0",
        "-1"
      ],
      [
        "0",
        "0",
        "1",
        "0",
        "2"
      ],
      [
        "0",
        "0",
        "0",
        "1",
        "0"
      ]
    ],
    "system": {
      "status": "unique",
      "x": [
        "1",
        "-1",
        "2",
        "0"
      ]
    }
  }
}
