{
  "schema_version": 1,
  "slug": "derivative-power-basic",
  "course": "MATH1004",
  "type": "derivative",
  "statement": "Differentiate f(x) = x^5.",
  "given": {
    "function": "x^5",
    "variable": "x"
  },
  "source": {
    "kind": "typed",
    "ref": "GoatVex benchmark (hand-checked)"
  },
  "context": {
    "graded": false
  },
  "confirmed_by_student": true,
  "expected": {
    "derivative": "5x^4"
  }
}
