{
  "schema_version": 1,
  "slug": "rref-sys-infinite-3x3",
  "course": "MATH1104",
  "type": "rref",
  "statement": "Solve x\u2081 + 2x\u2082 \u2212 x\u2083 = 3, 2x\u2081 + 5x\u2082 + x\u2083 = 8, 3x\u2081 + 7x\u2082 = 11.",
  "given": {
    "matrix": [
      [
        "1",
        "2",
        "-1",
        "3"
      ],
      [
        "2",
        "5",
        "1",
        "8"
      ],
      [
        "3",
        "7",
        "0",
        "11"
      ]
    ],
    "augmented": true
  },
  "source": {
    "kind": "typed",
    "ref": "GoatVex benchmark (hand-checked)"
  },
  "context": {
    "graded": false
  },
  "confirmed_by_student": true,
  "expected": {
    "rref": [
      [
        "1",
        "0",
        "-7",
        "-1"
      ],
      [
        "0",
        "1",
        "3",
        "2"
      ],
      [
        "0",
        "0",
        "0",
        "0"
      ]
    ],
    "system": {
      "status": "infinite",
      "free_vars": [
        3
      ]
    }
  }
}
